<?xml version='1.0' encoding='UTF-8' ?>
<!DOCTYPE dataset SYSTEM "./src/test/resources/dtd/topaze.dtd">
<dataset>
<contrat/>
<contrat id="10000" titre="Contrat Tedst" reference="00010000" idClient="10000"   datePreparation="[now]" dateValidation="[now]" dateDebutFacturation="[now]" politiqueResiliationId="10000"/>
<contrat id="10001" titre="Contrat Tedst" reference="00010000" idClient="10000"   datePreparation="[now]" dateValidation="[now]" dateDebutFacturation="[now]" politiqueResiliationId="10000"/>
<contrat id="10002" titre="Contrat Tedst" reference="00010000" idClient="10000"   datePreparation="[now]" dateValidation="[now]" dateDebutFacturation="[now]" politiqueResiliationId="10000"/>
<contrat id="10003" titre="Contrat Tedst" reference="00010000" idClient="10000"   datePreparation="[now]" dateValidation="[now]" dateDebutFacturation="[now]" politiqueResiliationId="10000"/>
<contrat id="10004" titre="Contrat Tedst" reference="00010000" idClient="10000"   datePreparation="[now]" dateValidation="[now]" dateDebutFacturation="[now]" politiqueResiliationId="10000"/>
<contrat id="10005" titre="Contrat Tedst" reference="00010000" idClient="10000"   datePreparation="[now]" dateValidation="[now]" dateDebutFacturation="[now]" politiqueResiliationId="10000"/>

<elementcontractuel/>
<elementcontractuel id="10000" numeroCommande="00010000" numEC="1" modeFacturation="DATE_ANNIVERSAIRE"  idAdrFacturation="id-fact" typeProduit="SERVICE" referenceProduit="avfwpro-confort-s" titre="Contrat ABONNEMENT pour le produit : avfwpro-confort-s" datePreparation="[now]" dateValidation="[now]"  dateDebutFacturation="[now]" contratParent="10000" montant="5" modePaiement="CB" typeTVA="R" periodicite="1" duree="24" engagement="12" dateDerniereFacture="[now+7days]" dateFinContrat="[now+10years]"  />
<elementcontractuel id="10001" numeroCommande="00010000" numEC="1" modeFacturation="DATE_ANNIVERSAIRE"  idAdrFacturation="id-fact" typeProduit="SERVICE" referenceProduit="avfwpro-confort-s" titre="Contrat ABONNEMENT pour le produit : avfwpro-confort-s" datePreparation="[now]" dateValidation="[now]"  dateDebutFacturation="[now]" contratParent="10001" montant="5" modePaiement="CB" typeTVA="R" periodicite="1" duree="24" engagement="12" dateDerniereFacture="[now+7days]" dateFinContrat="[now+10years]"  />
<elementcontractuel id="10002" numeroCommande="00010000" numEC="1" modeFacturation="DATE_ANNIVERSAIRE"  idAdrFacturation="id-fact" typeProduit="SERVICE" referenceProduit="avfwpro-confort-s" titre="Contrat ABONNEMENT pour le produit : avfwpro-confort-s" datePreparation="[now]" dateValidation="[now]"  dateDebutFacturation="[now]" contratParent="10002" montant="5" modePaiement="CB" typeTVA="R" periodicite="1" duree="24" engagement="12" dateDerniereFacture="[now+7days]" dateFinContrat="[now+10years]"  />
<elementcontractuel id="10003" numeroCommande="00010000" numEC="1" modeFacturation="DATE_ANNIVERSAIRE"  idAdrFacturation="id-fact" typeProduit="SERVICE" referenceProduit="avfwpro-confort-s" titre="Contrat ABONNEMENT pour le produit : avfwpro-confort-s" datePreparation="[now]" dateValidation="[now]"  dateDebutFacturation="[now]" contratParent="10003" montant="5" modePaiement="CB" typeTVA="R" periodicite="1" duree="24" engagement="12" dateDerniereFacture="[now+7days]" dateFinContrat="[now+10years]"  />
<elementcontractuel id="10004" numeroCommande="00010000" numEC="1" modeFacturation="DATE_ANNIVERSAIRE"  idAdrFacturation="id-fact" typeProduit="SERVICE" referenceProduit="avfwpro-confort-s" titre="Contrat ABONNEMENT pour le produit : avfwpro-confort-s" datePreparation="[now]" dateValidation="[now]"  dateDebutFacturation="[now]" contratParent="10004" montant="5" modePaiement="CB" typeTVA="R" periodicite="1" duree="24" engagement="12" dateDerniereFacture="[now+7days]" dateFinContrat="[now+10years]"  />
<elementcontractuel id="10005" numeroCommande="00010000" numEC="1" modeFacturation="DATE_ANNIVERSAIRE"  idAdrFacturation="id-fact" typeProduit="SERVICE" referenceProduit="avfwpro-confort-s" titre="Contrat ABONNEMENT pour le produit : avfwpro-confort-s" datePreparation="[now]" dateValidation="[now]"  dateDebutFacturation="[now]" contratParent="10005" montant="5" modePaiement="CB" typeTVA="R" periodicite="1" duree="24" engagement="12" dateDerniereFacture="[now+7days]" dateFinContrat="[now+10years]"  />

</dataset>