<?xml version='1.0' encoding='UTF-8' ?>
<!DOCTYPE dataset SYSTEM "./src/test/resources/dtd/topaze.dtd">
<dataset>

<contrat id="1" reference="REF_GB" titre="Contrat Pour Test" datePreparation="[now]"  />

<elementcontractuel id="1" numeroCommande="1" modePaiement="CHEQUE" periodicite="1" modeFacturation="PREMIER_MOIS"    referenceProduit="PROD-01" titre="Contrat ABONNEMENT" numEC="1" datePreparation="[now]" dateDebutFacturation="[now]" contratParent="1" referenceModePaiement="rum-0001" montant="22" typeTVA="S"/>
<elementcontractuel id="2" numeroCommande="1" modePaiement="CHEQUE" periodicite="1" modeFacturation="PREMIER_MOIS"   referenceProduit="PROD-02" titre="Contrat ABONNEMENT" numEC="2" datePreparation="[now]" dateDebutFacturation="[now]" contratParent="1" referenceModePaiement="rum-0001" montant="22" typeTVA="S"/>

<reduction id="1" contextReduction="GLOBAL" referenceContrat="REF_GB" typeValeur="MOIS" valeur="2" typeReduction="CONTRAT" nbUtilisationEnCours="0" nbUtilisationMax="2" isAffichableSurFacture="false" reference="REF_RED-1"  />
<reduction id="2" contextReduction="GLOBAL"  referenceContrat="REF_GB" typeValeur="MOIS" valeur="2" typeReduction="CONTRAT" nbUtilisationEnCours="0" nbUtilisationMax="2" isAffichableSurFacture="false" codeCatalogueReduction="ref-reduc" reference="REF_RED-2" />
 
<reduction id="3" contextReduction="GLOBAL" numEC="1" referenceContrat="REF_GB" typeValeur="MOIS" valeur="2" typeReduction="CONTRAT" nbUtilisationEnCours="0" nbUtilisationMax="2" isAffichableSurFacture="false"  reference="REF_RED-3" />
<reduction id="4" contextReduction="GLOBAL" numEC="2" referenceContrat="REF_GB" typeValeur="MOIS" valeur="2" typeReduction="CONTRAT" nbUtilisationEnCours="0" nbUtilisationMax="2" isAffichableSurFacture="false" codeCatalogueReduction="ref-reduc" reference="REF_RED-4" />

</dataset>